{
  "seq": 10,
  "type": "ticket.created",
  "occurred_at": "2026-10-28T22:26:38.003Z",
  "client_id": "2def4a1a-74f9-47b9-a3f5-46a4d20b60b3",
  "subject": {
    "kind": "ticket",
    "id": "9e4317e9-eead-4e5b-82ef-6c2d2e291aaf"
  },
  "data": {
    "id": "9e4317e9-eead-4e5b-82ef-6c2d2e291aaf",
    "number": "SM-1003",
    "title": "Everything is slow today",
    "priority": "P3",
    "status": "new",
    "sla_due_at": "2026-10-29T06:26:38.003Z",
    "affected_node_ids": [
      "e3508dfc-ce92-44ab-ac77-de8252b95b91",
      "dfcd0486-f391-4433-a3e5-1ad009eea74d"
    ]
  }
}
